<?xml version="1.0" encoding="UTF-8"?>
<course xmlns:xsi="http://www.w3.org/2001/XMLSchema" xsi:noNamespaceSchemaLocation="course.xsd">
    <id>1</id>
    <courseName>Mathematics</courseName>
    <credit>3.0</credit>

    <onlineCourses>
        <onlineCourse>
            <id>101</id>
            <url>https://example.com/math101</url>
            <!-- TODO Add Grade info -->
        </onlineCourse>
        <onlineCourse>
            <id>102</id>
            <url>https://example.com/math102</url>
            <!-- TODO Add Grade information  -->
        </onlineCourse>
    </onlineCourses>

    <onsiteCourses>
        <onsiteCourse>
            <id>201</id>
            <roomNumber>301</roomNumber>
            <date>2024-01-10T10:00:00</date>
            <!-- TODO Add Attendance information  -->
        </onsiteCourse>
        <onsiteCourse>
            <id>202</id>
            <roomNumber>302</roomNumber>
            <date>2024-01-15T13:30:00</date>
            <!-- TODO Add Attendance information  -->
        </onsiteCourse>
    </onsiteCourses>

    <enrollments>
        <enrollment>
            <id>301</id>
            <enrollmentDate>2024-01-01</enrollmentDate>
        </enrollment>
        <enrollment>
            <id>302</id>
            <enrollmentDate>2024-01-05</enrollmentDate>
        </enrollment>
    </enrollments>
</course>
